{
  "slug": "docs-and-verified-discovery",
  "phase": "test",
  "status": "ok",
  "round": 1,
  "inputs": [
    ".gogo/plans/feature-docs-and-verified-discovery/plan.md",
    ".gogo/knowledge/test-strategy.md",
    ".gogo/knowledge/testing-tools.md",
    "docs/_config.yml",
    "docs/index.md",
    "docs/commands.md",
    "docs/flow.md",
    "docs/agents.md",
    "docs/discovery.md",
    "docs/contracts.md",
    "docs/architecture.md",
    "skills/gogo-build/SKILL.md",
    "skills/gogo/SKILL.md",
    "templates/knowledge/_discovered.md",
    "templates/contracts/issues-list.schema.json",
    "commands/build.md",
    "agents/gogo-developer.md",
    "agents/gogo-reviewer.md"
  ],
  "outputs": [
    ".gogo/plans/feature-docs-and-verified-discovery/test/issues.json",
    ".gogo/plans/feature-docs-and-verified-discovery/test-01.md",
    ".gogo/plans/feature-docs-and-verified-discovery/test/result.json"
  ],
  "validated_in": true,
  "validated_out": true,
  "open_issues": 1,
  "summary": "Round 1 test: docs structure/content PASS; Part B fixture dogfood PASS (Vitest+pnpm corrected, TypeScript verified, prose unverifiable, CLAUDE.md untouched); 1 nit (TEST-001 — missing checkmark in discovery.md mermaid). Verdict: GREEN, advancing to report."
}
