{
  "slug": "persistent-session-orchestrator",
  "phase": "test",
  "status": "ok",
  "round": 1,
  "inputs": [
    ".gogo/work/feature-persistent-session-orchestrator/plan.md",
    ".gogo/work/feature-persistent-session-orchestrator/review/issues.json",
    ".gogo/knowledge/test-strategy.md",
    ".gogo/knowledge/testing-tools.md",
    ".gogo/knowledge/tech-stack.md",
    ".gogo/knowledge/non-functional-requirements.md"
  ],
  "outputs": [
    ".gogo/work/feature-persistent-session-orchestrator/test/issues.json",
    ".gogo/work/feature-persistent-session-orchestrator/test-01.md",
    ".gogo/work/feature-persistent-session-orchestrator/test/result.json"
  ],
  "validated_in": true,
  "validated_out": true,
  "open_issues": 0,
  "summary": "GREEN. Go suite green (gofmt/vet/race clean, 149/149 tests incl. hermetic stub-claude e2e), hands-on CLI gate/refusal/sweep checks all correct incl. sparing the live in-flight tmux session. TEST-001 (the true e2e) resolved via D7 -> light real smoke: `gogo plan psorch-smoke` drove a REAL claude -p leg — fresh --session-id, real exec + JSON-envelope parse, correct awaiting-plan-acceptance exit classification (exit 2), registry booked (uuid + parked + cost 4.69/11 turns), lock released. TEST-001 closed verified; no open issues."
}
