{
  "slug": "notify-only-at-user-gates",
  "phase": "implement",
  "status": "ok",
  "round": 3,
  "inputs": [
    ".gogo/work/feature-notify-only-at-user-gates/plan.md",
    ".gogo/work/feature-notify-only-at-user-gates/decisions.md",
    ".gogo/work/feature-notify-only-at-user-gates/review/issues.json",
    ".gogo/knowledge/coding-rules.md",
    ".gogo/knowledge/tech-stack.md"
  ],
  "outputs": [
    "hooks/notify.sh",
    "hooks/hooks.json",
    "cli/notify_hook_test.go",
    "cli/main.go",
    "cli/version_test.go",
    "README.md",
    "docs/flow.md",
    "skills/gogo/SKILL.md",
    ".claude-plugin/plugin.json",
    ".gogo/work/feature-notify-only-at-user-gates/charts/flow.mmd",
    ".gogo/work/feature-notify-only-at-user-gates/charts/sequence.mmd",
    ".gogo/work/feature-notify-only-at-user-gates/charts/manifest.json",
    ".gogo/work/feature-notify-only-at-user-gates/review/issues.json"
  ],
  "validated_in": true,
  "validated_out": true,
  "open_issues": 0,
  "summary": "Round 3: fixed the 6 round-2 findings - latch write now unconditionally in main and pinned by a no-hand-state e2e pair (REV-010 mutation bites: 39/42 exit 1), quiet brace-guarded writes + readonly-.gogo case (REV-011), seen-file moved to gitignored .gogo/resources/notify/gates (REV-012), latch read folded into decide killing the double scan (816ms -> ~430ms, REV-013), manifest/titles name the latch (REV-014), decide comment true again + dead local gone (REV-015). Selftest 42/42 on bash 5.3 + 3.2; gofmt/vet/race green."
}
