{
  "slug": "project-first-plan-authoring",
  "phase": "review",
  "status": "ok",
  "round": 2,
  "inputs": [
    ".gogo/work/feature-project-first-plan-authoring/plan.md",
    ".gogo/work/feature-project-first-plan-authoring/state.md",
    ".gogo/work/feature-project-first-plan-authoring/charts/manifest.json",
    ".gogo/work/feature-project-first-plan-authoring/review/issues.json",
    ".gogo/knowledge/code-review-standards.md",
    ".gogo/knowledge/coding-rules.md",
    ".gogo/knowledge/non-functional-requirements.md",
    ".gogo/knowledge/test-strategy.md"
  ],
  "outputs": [
    ".gogo/work/feature-project-first-plan-authoring/review/issues.json",
    ".gogo/work/feature-project-first-plan-authoring/review-02.md",
    ".gogo/work/feature-project-first-plan-authoring/review/result.json"
  ],
  "validated_in": true,
  "validated_out": true,
  "open_issues": 2,
  "summary": "Round 2 fix-verification: all 7 round-1 findings VERIFIED (REV-002 and REV-005 by two-part mutation in a throwaway copy of cli/, not by reading); 2 new minors appended - REV-008 (charts/manifest.json note still names the deleted plans.AddAttachment) and REV-009 (the new newForm wiring guard passes vacuously on an empty scan, and a sibling test mutates the cwd it reads with raw os.Chdir instead of go1.25 t.Chdir). Gates re-run by review: gofmt clean, go vet clean, go test -race ./... green uncached. No open blockers/majors - verdict APPROVE, advance to phase 4 test."
}
