{
  "slug": "plan-readiness-gate",
  "phase": "implement",
  "status": "ok",
  "round": 8,
  "inputs": [
    ".gogo/knowledge/code-review-standards.md",
    ".gogo/knowledge/coding-rules.md",
    ".gogo/knowledge/non-functional-requirements.md",
    ".gogo/knowledge/tech-stack.md",
    ".gogo/knowledge/test-strategy.md",
    ".gogo/work/feature-plan-readiness-gate/adjustments.md",
    ".gogo/work/feature-plan-readiness-gate/decisions.md",
    ".gogo/work/feature-plan-readiness-gate/plan.md",
    ".gogo/work/feature-plan-readiness-gate/review/issues.json",
    ".gogo/work/feature-plan-readiness-gate/test/issues.json"
  ],
  "outputs": [
    ".claude-plugin/plugin.json",
    ".gogo/knowledge/code-review-standards.md",
    ".gogo/knowledge/non-functional-requirements.md",
    ".gogo/knowledge/project-knowledge.md",
    ".gogo/work/feature-plan-readiness-gate/adjustments.md",
    ".gogo/work/feature-plan-readiness-gate/charts/flow.mmd",
    ".gogo/work/feature-plan-readiness-gate/charts/layouts.json",
    ".gogo/work/feature-plan-readiness-gate/charts/manifest.json",
    ".gogo/work/feature-plan-readiness-gate/charts/sequence.mmd",
    ".gogo/work/feature-plan-readiness-gate/charts/state.mmd",
    ".gogo/work/feature-plan-readiness-gate/review/issues.json",
    ".gogo/work/feature-plan-readiness-gate/test/issues.json",
    "README.md",
    "cli/cap_rule_test.go",
    "cli/go.go",
    "cli/go_cap_test.go",
    "cli/go_e2e_test.go",
    "cli/go_plan_readiness_test.go",
    "cli/internal/contract/authoring_test.go",
    "cli/internal/contract/contract.go",
    "cli/internal/contract/state.go",
    "cli/internal/contract/testdata/repo/.gogo/work/feature-inprogress/plan.md",
    "cli/internal/contract/testdata/repo/.gogo/work/feature-unfinished/plan.md",
    "cli/internal/launch/launch.go",
    "cli/internal/launch/session_action_test.go",
    "cli/internal/orchestrator/cap.go",
    "cli/internal/orchestrator/cap_test.go",
    "cli/internal/tui/authoring_test.go",
    "cli/internal/tui/config_tab.go",
    "cli/internal/tui/drill.go",
    "cli/internal/tui/model.go",
    "cli/internal/tui/move.go",
    "cli/internal/tui/pickup.go",
    "cli/internal/tui/pickup_test.go",
    "cli/internal/tui/styles.go",
    "cli/internal/tui/view.go",
    "cli/main.go",
    "cli/skills_lint_test.go",
    "cli/status.go",
    "cli/status_test.go",
    "cli/version_test.go",
    "commands/accept.md",
    "docs/cli-contract.md",
    "docs/commands.md",
    "docs/flow.md",
    "docs/index.md",
    "skills/gogo-accept/SKILL.md",
    "skills/gogo-cli/SKILL.md",
    "skills/gogo-implement/SKILL.md",
    "skills/gogo-plan/SKILL.md",
    "skills/gogo-review/SKILL.md",
    "skills/gogo-status/SKILL.md",
    "skills/gogo-test/SKILL.md",
    "skills/gogo/SKILL.md",
    "templates/state.template.md"
  ],
  "validated_in": true,
  "validated_out": true,
  "summary": "Test round 3 (user's fix-now call): TEST-002 - the board's m/M never consulted WaitingForUser(), so a card paused at a decision gate opened a real /gogo:go confirmation with only a STOP instruction in the spawned session's prompt preventing the relaunch; the guard now sits in attemptActionForce outside every !force condition (FR4a's shape), names the decision ID and /gogo:resume, and its interaction with REV-022's scoped exit write is pinned in BOTH directions (the gate holds; a legitimate resume re-opens it). TEST-003 - the standards guard is now wrap-insensitive, proven by a control pair. All four gates rc=0; 14 mutations caught + a control pair, 1 correctly unscored.",
  "open_issues": 0
}
