{
  "slug": "xplan-board-and-simple-done",
  "phase": "review",
  "status": "ok",
  "round": 2,
  "inputs": [
    ".gogo/work/feature-xplan-board-and-simple-done/plan.md",
    ".gogo/work/feature-xplan-board-and-simple-done/decisions.md",
    ".gogo/work/feature-xplan-board-and-simple-done/charts/xplan-board-flow.mmd",
    ".gogo/work/feature-xplan-board-and-simple-done/review/issues.json",
    ".gogo/knowledge/code-review-standards.md",
    ".gogo/knowledge/coding-rules.md",
    ".gogo/knowledge/non-functional-requirements.md",
    ".gogo/knowledge/tech-stack.md",
    "assets/xplan-board/server.py",
    "assets/xplan-board/src/App.tsx",
    "assets/xplan-board/src/tokens.ts",
    "assets/xplan-board/src/board.css",
    "assets/xplan-board/src/main.tsx",
    "assets/xplan-board/vite.config.ts",
    "assets/xplan-board/package.json",
    "assets/xplan-board/index.html",
    "assets/xplan-board/dist/index.html",
    "assets/xplan-board/dist/assets/index-C0I4sPZV.js",
    "assets/xplan-board/dist/assets/index-DD6xlZMd.css",
    "skills/gogo-xplan/SKILL.md",
    "commands/xplan.md",
    "skills/gogo/SKILL.md",
    "skills/gogo-status/SKILL.md",
    "skills/gogo-done/SKILL.md",
    "skills/gogo-view/SKILL.md",
    "commands/done.md",
    "commands/view.md",
    "docs/architecture.md",
    ".gitignore",
    ".claude-plugin/plugin.json"
  ],
  "outputs": [
    ".gogo/work/feature-xplan-board-and-simple-done/review/issues.json",
    ".gogo/work/feature-xplan-board-and-simple-done/review/review-02.md",
    ".gogo/work/feature-xplan-board-and-simple-done/review/result.json"
  ],
  "validated_in": true,
  "validated_out": true,
  "open_issues": 5,
  "summary": "Stage B APPROVE (no blockers/majors): server.py security STRONG (localhost-only, traversal contained live, ready-only guard, atomic write, 202/400/409, --selftest PASS exit0/2, pure-stdlib+ASCII); App<->board.json<->skill contract consistent (one dead `version` chip); dist in sync with src, node_modules gitignored + dist stageable; 0.8.0 writer byte-identical; FR8 product sweep complete (13 commands, 0.10.0, no TUI residue). 5 open findings: REV-003 dead version chip, REV-004 stuck shipping toast (no timeout), REV-005 FR8 residue in 2 .gogo/knowledge files (incl. deleted board.py ref), REV-006 POST TOCTOU (nit, non-triggerable), REV-007 no Host/Origin check (nit, user-decision, accepted no-auth scope). Prior REV-001/002 re-verified fixed."
}
