{
  "slug": "docs-and-verified-discovery",
  "phase": "report",
  "status": "ok",
  "inputs": [
    ".gogo/plans/feature-docs-and-verified-discovery/plan.md",
    ".gogo/plans/feature-docs-and-verified-discovery/state.md",
    ".gogo/plans/feature-docs-and-verified-discovery/review/issues.json",
    ".gogo/plans/feature-docs-and-verified-discovery/test/issues.json",
    ".gogo/plans/feature-docs-and-verified-discovery/charts/manifest.json"
  ],
  "outputs": [
    ".gogo/plans/feature-docs-and-verified-discovery/plan.md",
    ".gogo/plans/feature-docs-and-verified-discovery/report.md",
    ".gogo/plans/feature-docs-and-verified-discovery/charts/manifest.json",
    ".gogo/plans/feature-docs-and-verified-discovery/state.md"
  ],
  "validated_in": true,
  "validated_out": true,
  "summary": "Report phase: finalized plan.md to as-built and wrote report.md for the docs site + code-verified discovery feature. Review APPROVE (REV-001/002/003 verified) and test GREEN (TEST-001 verified). Version 0.4.0; D4 (enable Pages via gh, source main /docs) pending after release."
}
