{
  "slug": "plans-tab-launch-diagnostics-and-view",
  "phase": "test",
  "status": "ok",
  "round": 2,
  "inputs": [
    ".gogo/work/feature-plans-tab-launch-diagnostics-and-view/plan.md",
    ".gogo/work/feature-plans-tab-launch-diagnostics-and-view/review-02.md",
    ".gogo/work/feature-plans-tab-launch-diagnostics-and-view/test-01.md",
    ".gogo/work/feature-plans-tab-launch-diagnostics-and-view/test/issues.json",
    ".gogo/knowledge/test-strategy.md",
    ".gogo/knowledge/testing-tools.md",
    ".gogo/knowledge/tech-stack.md",
    ".gogo/knowledge/non-functional-requirements.md",
    "cli/internal/tui/confirm_default_test.go"
  ],
  "outputs": [
    ".gogo/work/feature-plans-tab-launch-diagnostics-and-view/test/issues.json",
    ".gogo/work/feature-plans-tab-launch-diagnostics-and-view/test-02.md",
    ".gogo/work/feature-plans-tab-launch-diagnostics-and-view/test/result.json"
  ],
  "validated_in": true,
  "validated_out": true,
  "open_issues": 0,
  "summary": "Round 2: re-confirmed build/unit green (gofmt/vet/go test -race, all 13 packages), then re-verified TEST-001's fix live against the real binary, not just the developer's new confirm_default_test.go. Drove bare Enter on a fresh plans-tab spawn confirm (plan-kastestr2go1: real tmux session created, plan flipped ready->active, member recorded) and a fresh plans-tab project-UAT accept confirm (plan-kastestr2uat1, built with a genuinely-shipped, correctly-correlated member to avoid the 'not found vs not shipped' trap: plan flipped to done, a ## Project UAT round appended) - both are real side effects, not just closed dialogs. Re-confirmed the board's own m-then-bare-Enter launch is unchanged. Highest-priority check: drove the destructive half of the confirm-default convention live - a bare Enter on x (delete) and on K (kill) both still report 'cancelled', leaving the feature on disk / the session alive - the safety convention did not move. Regression resweep (scoped down per orthogonality, stated explicitly): fold-to-pointer re-driven clean via bare Enter (pointer text confirmed in the launched session's pane), v/w re-driven from both list and detail origins (marker rendered, esc clean both times, ~/.gogo/-only write invariant reconfirmed), one dangling-target refusal and one incidental cap-bounce as the scoped severity check; the backstop, REV-009 and the full cap sweep were explicitly NOT re-derived (orthogonal to a confirm-default change, already verified round 1). test/issues.json updated in place: TEST-001 -> verified, 0 open issues, no new findings. The two real user tmux sessions were confirmed present/untouched before and after; every scratch/fixture session created this round was killed by exact name."
}
